Serial No,Name,Description,Link,Tags
1,52° North GmbH,52°North works on innovative ideas and technologies in geoinformatics,https://52north.org,"['java', 'android', 'javascript', 'python', 'react']"
2,AboutCode.org,"Find the origin, license and vulnerabilities of your code and deps.",https://www.aboutcode.org,"['python', 'c/c++', 'rust', 'javascript', 'postgresql']"
3,Academy Software Foundation (ASWF),Open source foundation for film industry projects.,http://aswf.io,"['c/c++', 'python']"
4,Accord Project,Linux Foundation’s open source project for smart legal contracts.,https://www.accordproject.org/,"['javascript', 'react', 'coq', 'ocaml', 'compiler']"
5,AerospaceResearch.net,making space together,http://www.aerospaceresearch.net,"['python', 'vhdl', 'raspberry pi', 'sqlite', 'c++']"
6,afl++,Making fuzzing more effective every day,https://aflplus.plus/,"['fuzzing', 'c/c++', 'qemu', 'llvm', 'sanitizers']"
7,Amahi,Making Home Networking and Storage Simple,https://www.amahi.org,"['ruby on rails', 'javascript', 'android', 'golang', 'swift']"
8,Android Graphics Tools Team,Providing excellent tools for graphics developers and driver makers,https://github.com/google/graphicsfuzz/blob/master/docs/summer-of-code-ideas/2020.md,"['vulkan', 'opengl', 'c/c++', 'java', 'python 3']"
9,AnitaB.org Open Source,Women transform technology. Technology transforms the world.,http://anitab.org,"['ios', 'android', 'python', 'javascript']"
10,AOSSIE,Australian Umbrella Org for Open-Source Projects,https://aossie.gitlab.io/,"['javascript', 'swift', 'kotlin', 'python']"
11,Apertium,A free/open-source machine translation platform,https://apertium.org,"['c++', 'bash', 'python', 'xml']"
12,apertus° Association,Open Technology for Professional Film Production,https://www.apertus.org,"['fpga', 'vhdl', 'c/c++', 'linux', 'embedded']"
13,appleseed,A modern open source rendering engine for animation and visual effects,https://appleseedhq.net/,"['c++11', 'python', 'opengl']"
14,Arduino,Open source electronic prototyping platform,https://arduino.cc,"['arduino', 'golang', 'c/c++']"
15,ArduPilot,"The world's most versatile, trusted and open autopilot",https://ardupilot.org,"['drones', 'python', 'robotics', 'linux', 'c/c++']"
16,BeagleBoard.org,Open hardware community driven single board computers - Linux at the edge,https://beagleboard.org,"['linux', 'tensorflow', 'python', 'javascript', 'opencv']"
17,BioGears,ARA is an employee-owned scientific research and engineering company.,https://www.biogearsengine.com/,"['c++11', 'c/c++', 'python', 'cmake']"
18,Blender Foundation,We build a free and open source 3D creation suite.,https://www.blender.org,"['c', 'c++', 'python', 'opengl', 'vulkan']"
19,Boost C++,Boost provides free peer-reviewed portable C++ source libraries,http://www.boost.org,"['c++17', 'c++11', 'c++']"
20,BRL-CAD,"We make solid modeling, 3D printing, & other computer-aided technologies (CAx)",https://brlcad.org,"['opencl', 'c/c++', 'python', 'tcl/tk', 'opengl']"
21,caMicroscope,Toolkit for cancer imaging research,http://camicroscope.github.io,"['javascript', 'python', 'java', 'medical imaging', 'tensorflow']"
22,Canadian Centre for Computational Genomics,Analytical solutions for Next-Generation Sequencing data,http://computationalgenomics.ca/,"['python', 'r-project', 'javascript', 'react', 'nodejs']"
23,Casbin,"Authorization library that supports access control models like ACL, RBAC, ABAC",https://casbin.org/,"['go', 'javascript', 'react', 'rust', 'python']"
24,Catrobat,Computational thinking for all with free visual coding apps,http://www.catrobat.org,"['java', 'android', 'swift', 'ios', 'php']"
25,CCExtractor Development,"Tools to make the world more accessible. ML/AI, Rust, Flutter, peer-to-peer...",https://ccextractor.org/,"['c', 'python', 'ml', 'flutter', 'rust']"
26,Ceph Foundation,The Future of Storage,https://ceph.io,"['c/c++', 'jenkins', 'python', 'javascript', 'shell script']"
27,CERN-HSF,The umbrella organization for Particle (High-Energy) Physics-related projects,http://hepsoftwarefoundation.org/activities/gsoc.html,"['c/c++', 'python', 'data analysis', 'machine learning', 'concurrency']"
28,CGAL Project,C++ library of computational geometry and geometry processing,https://www.cgal.org,"['c++', 'git', 'qt']"
29,CHAOSS,CHAOSS creates software and metrics to better understand community health,https://chaoss.community/,"['python', 'javascript', 'kibana', 'elasticsearch', 'mysql']"
30,Chapel,A Productive Parallel Programming Language,https://chapel-lang.org/,"['chapel', 'high performance computing', 'c', 'c++', 'python']"
31,Checker Framework,"Prevent programming errors before they happen, via easy-to-use verification",https://checkerframework.org/,['java']
32,Checkstyle,Tool to help programmers write Java code that adheres to a coding standard.,https://checkstyle.org,"['java', 'antlr', 'xpath']"
33,CircuitVerse.org,Have fun exploring logic circuits right from your browser!,http://circuitverse.org/,"['rails', 'javascript', 'bootstrap', 'html5', 'canvas']"
34,CiviCRM,Open source CRM for nonprofits and civic sector organizations.,https://civicrm.org,"['php', 'javascript', 'angularjs', 'mysql']"
35,Cloud Native Computing Foundation (CNCF),Building Sustainable Ecosystems for Cloud Native,https://www.cncf.io,"['kubernetes', 'golang', 'cloud', 'rust', 'service mesh']"
36,CloudCV,Building platforms for reproducible AI research,https://cloudcv.org,"['python', 'django', 'aws', 'docker', 'docker']"
37,Continuous Delivery Foundation,A Neutral Home for the Next Generation of Continuous Delivery Collaboration,https://cd.foundation,"['tekton', 'spinnaker', 'ci/cd', 'screwdriver']"
38,coreboot,"Fast, secure and flexible OpenSource firmware",https://www.coreboot.org/,"['c', 'assembly', 'x86', 'arm']"
39,Creative Commons,"Nonprofit building a vibrant, collaborative, and global digital commons.",https://opensource.creativecommons.org,"['javascript', 'vue.js', 'python', 'django', 'wordpress']"
40,CRIU,Checkpoint/Restore in User-space,https://criu.org,"['linux', 'c', 'assembly']"
41,Cuneiform Digital Library Initiative (CDLI),International digital library of artifacts inscribed with cuneiform writing,https://cdli.ucla.edu,"['python 3', 'php', 'mysql', 'html', 'css']"
42,Dart,Dart is a client-optimized language for fast apps on any platform.,https://dart.dev/,"['dart', 'flutter', 'programming-language']"
43,DBpedia,Global and Unified Access to Knowledge.,https://wiki.dbpedia.org/gsoc-2020,"['python', 'scala', 'java', 'javascript', 'rdf']"
44,Debian,The Universal Operating System,https://www.debian.org,"['git', 'python', 'javascript', 'c/c++', 'irc']"
45,Digital Impact Alliance (DIAL) at UN Foundation,"Open source projects for humanitarian work, international development, and peace",https://www.digitalimpactalliance.org,"['c++', 'javascript', 'android', 'php', 'python']"
46,Django Software Foundation,The web framework for perfectionists with deadlines.,https://www.djangoproject.com,"['python', 'django']"
47,Drupal,Drupal is a Framework/CMS. It's built many of the sites and apps you use daily.,https://www.drupal.org/,"['php', 'symfony', 'sql', 'javascript', 'drupal 8']"
48,Eclipse Foundation,"Non-profit, member-driven organization, a community of developers & OSS projects",https://www.eclipse.org/org/foundation/,"['eclipsejavaide', 'jakartaee', 'java', 'che', 'deep learning']"
49,Elastic,"We are the creators of Elasticsearch, Kibana, Beats, and Logstash.",https://elastic.co,"['java', 'react', 'node.js', 'golang']"
50,Embox,Modular and configurable OS for embedded applications,http://embox.github.io,"['c', 'gcc', 'assembly']"
51,Erlang Ecosystem Foundation,Supporting the Beam community,http://erlef.org,"['erlang', 'elixir', 'lfe', 'beam']"
52,Fedora Project,"Fedora Linux is built on the foundations of Freedom, Friends, Features, & First",https://getfedora.org/,"['python 3', 'rest', 'linux', 'web development', 'linux distribution']"
53,FFmpeg,"A complete, cross-platform solution to record, convert and stream audio & video",https://ffmpeg.org/,"['c', 'asm', 'git']"
54,FOSSology,Open Source Compliance with Open Source Software,https://www.fossology.org/,"['php', 'javascript', 'c/c++', 'twig', 'python']"
55,FrameNet Brasil (UFJF),Natural Language Understanding with structured computational semantics,http://www.ufjf.br/framenetbr-eng/,"['php', 'mysql', 'javascript', 'python']"
56,Free and Open Source Silicon Foundation,Free the last nanometer! Open source silicon and EDA tools,https://fossi-foundation.org/,"['verilog', 'risc-v', 'python', 'c++']"
57,FreeBSD Project,FreeBSD: The Foundation of the Internet,https://www.freebsd.org/,"['c/c++', 'llvm', 'shell script', 'assembly', 'make']"
58,FreeType,FreeType is a freely available software library to render fonts.,https://freetype.org,"['c', 'gnu make', 'gnu autotools', 'python', 'fonts']"
59,FRRouting,"Routing suite for *nix platforms including BGP, IS-IS, LDP, OSPF, PIM, and RIP.",https://frrouting.org/,"['c', 'linux', 'linux kernel', 'networking', 'lua']"
60,GDevelop,The cross-platform game engine designed for everyone.,https://gdevelop-app.com,"['javascript', 'c/c++', 'web development', 'game development', 'react']"
61,Gentoo Foundation,"A highly flexible, source-based Linux distribution",https://gentoo.org,"['shell', 'bash', 'c/c++', 'python', 'linux']"
62,GeomScale,Scalable algorithms for geometric statistics,https://geomscale.github.io/,"['c++', 'r', 'python']"
63,Git,"fast, scalable, distributed revision control system",http://git-scm.com,"['c', 'shell script', 'git']"
64,Global Alliance for Genomics and Health,We develop open standards and tools for genomics to benefit human health,https://www.ga4gh.org/,"['java', 'python', 'node.js', 'mongodb', 'spring']"
65,GNOME,The elegant and ethical desktop experience,https://www.gnome.org/,"['c', 'rust', 'gtk', 'vala', 'python']"
66,GNSS-SDR,An open source Global Navigation Satellite Systems software-defined receiver.,https://gnss-sdr.org,"['c++', 'gnss']"
67,GNU Compiler Collection (GCC),GCC,https://gcc.gnu.org/,"['c/c++', 'gnu autotools', 'gnu make']"
68,GNU Octave,Free Your Numbers,https://www.octave.org,"['c++', 'hg']"
69,GNU Radio,The Free & Open Software Radio Ecosystem,https://www.gnuradio.org/,"['python', 'c++', 'qt']"
70,Godot Engine,Godot is a multi-platform 2D and 3D game engine with a feature-rich editor,https://godotengine.org,"['c/c++', 'opengl', 'vulkan']"
71,GPAC,C multimedia framework,http://gpac.io,"['c', 'javascript', 'opengl']"
72,GraphQL Foundation,GraphQL is a fast and efficient query language for APIs.,https://graphql.org,"['graphql', 'javascript', 'react', 'node.js']"
73,Haiku,A desktop operating system written in C++,http://www.haiku-os.org,"['c++', 'posix', 'unix', 'webkit']"
74,Haskell.org,"Standardized, statically typed, lazy functional programming language",http://haskell.org,"['haskell', 'ghc', 'cabal', 'codeworld', 'servant']"
75,Hazelcast,In-Memory Computing Platform,https://www.hazelcast.org/,"['java', 'distributed systems']"
76,Homebrew,The Missing Package Manager for macOS (or Linux),https://brew.sh,"['ruby', 'bash']"
77,Hydra Ecosystem,Automate REST APIs. Build next generation API clients.,https://www.hydraecosystem.org/,"['python', 'rest', 'apis', 'hydra']"
78,INCF,Enabling open and FAIR neuroscience,https://www.incf.org,"['python', 'c/c++', 'java', 'tensorflow', 'javascript']"
79,Inclusive Design Institute,The IDI addresses the challenge of designing ICT to work for all potential users,https://inclusivedesign.ca,"['javascript', 'html', 'css', 'node.js']"
80,Inkscape,Vector graphics editor,https://inkscape.org,"['c++', 'svg', 'gtk', 'python']"
81,Intel Media And Audio For Linux,We work on Linux opensource video and audio software for Intel.,https://01.org/linuxmedia,"['ffmpeg', 'gstreamer', 'sound open firmware', 'libxcam', 'vaapi']"
82,Internet Archive,Universal Access to All Knowledge,http://archive.org,"['javascript', 'python']"
83,JBoss Community,Community of Java projects around JBoss Middleware,http://www.jboss.org/,"['java', 'golang', 'react']"
84,JdeRobot - Universidad Rey Juan Carlos,A software toolkit for developing applications in Robotics and Computer Vision,http://jderobot.github.io,"['ros', 'gazebo', 'python', 'c/c++', 'opencv']"
85,Jenkins project,Open-source automation server for building great things at any scale,http://jenkins.io,"['java', 'javascript', 'docker', 'kubernetes', 'go']"
86,Joplin,A note taking and to-do application with synchronisation capabilities,https://joplinapp.org/,"['node.js', 'electron', 'react native', 'terminal-kit', 'react']"
87,Kapitan,"Templated configuration management for Kubernetes, Terraform and other things",https://kapitan.dev/,"['kubernetes', 'jsonnet', 'python 3', 'jinja2', 'terraform']"
88,KDE Community,International community creating Free Software together,https://www.kde.org,"['c++', 'qt', 'c', 'opencv']"
89,Kiwix,Internet content for people without internet access,https://www.kiwix.org,"['python 3', 'c/c++', 'javascript', 'node.js', 'kotlin']"
90,Kodi Foundation,The ultimate entertainment center,http://www.kodi.tv,"['ffmpeg', 'python', 'c++', 'sqlite', 'mysql']"
91,Kubeflow,The machine learning toolkit for Kubernetes.,http://kubeflow.org,"['python', 'jupyter notebook', 'tensorflow', 'kustomize', 'kubernetes']"
92,LabLua,Programming Languages Research with emphasis on the Lua language,http://www.lua.inf.puc-rio.br,"['lua', 'céu', 'lunatik', 'pallene']"
93,Libre Space Foundation,Open-source software and hardware technologies for space,https://libre.space,"['python', 'django', 'sdr', 'embedded', 'space applications']"
94,LibreHealth,Healthcare for Humanity,https://librehealth.io,"['java', 'javascript', 'python 3', 'android', 'php']"
95,LibreOffice,LibreOffice is a free and open source office suite.,https://www.libreoffice.org,"['c++', 'python', 'java']"
96,libvirt,virtualization abstraction library,http://libvirt.org/,"['kvm', 'xen', 'hypervisor', 'c', 'python']"
97,Linkerd,Linkerd is the ultralight service mesh for Kubernetes and beyond,https://linkerd.io/,"['linkerd', 'kubernetes', 'golang', 'rust']"
98,Liquid Galaxy project,Liquid Galaxy is a remarkable panoramic system that is tremendously compelling.,https://www.liquidgalaxy.eu/,"['python', 'vue', 'html', 'javascript', 'java']"
99,lowRISC,Open to the core - collaborative engineering for open source silicon and tools,https://www.lowrisc.org,"['systemverilog', 'c++', 'fpga', 'python', 'risc-v']"
100,MacPorts,Open Source package manager for macOS.,https://www.macports.org/,"['tcl', 'c', 'python', 'scripting', 'buildbot']"
101,MariaDB Foundation,One of the most popular databases on the web with many notable users,https://mariadb.org,"['mariadb', 'mysql', 'c', 'c++', 'java']"
102,Matrix,"An open network for secure, decentralized communication",https://matrix.org,"['python', 'javascript', 'rust', 'go', 'react']"
103,MBDyn,Free general purpose Multibody Dynamics analysis,https://www.mbdyn.org/,"['c++', 'python']"
104,MDAnalysis,A Python toolkit for analysing molecular dynamics simulations.,https://www.mdanalysis.org,"['python', 'cython', 'numpy', 'c/c++']"
105,MetaBrainz Foundation Inc.,"We curate and publish community maintained data sets, focused on music and books",https://metabrainz.org,"['python', 'postgres', 'solr', 'perl', 'spark']"
106,Metasploit,The world’s most used penetration testing framework,https://metasploit.com,"['ruby', 'postgresql', 'python', 'c', 'assembly']"
107,MGGG Redistricting Lab,MGGG researches applications in math and computer science for US redistricting,http://mggg.org,"['python', 'javascript', 'gis', 'julia', 'mapping']"
108,MIT App Inventor,Anyone Can Build Apps That Impact the World,http://appinventor.mit.edu,"['javascript', 'java', 'google web toolkit', 'android', 'junit']"
109,Mixxx,DJ Mixing App With Powerful Features For All DJs,https://www.mixxx.org,"['c++', 'qt', 'javascript', 'deep learning']"
110,mlpack,"mlpack is a fast, flexible machine learning library written in C++.",http://mlpack.org/,"['c++', 'python', 'templates', 'machine learning', 'deep learning']"
111,Moira,Moira is a realtime alerting system based on Graphite data,https://moira.readthedocs.io/,"['golang', 'javascript', 'typescript', 'graphite', 'react']"
112,MoveIt,Moving robots into the future,https://moveit.ros.org,"['c++', 'ros']"
113,Mozilla,Keeping the Internet open and accessible to all.,https://mozilla.org,"['javascript', 'rust', 'html5', 'web development', 'python']"
114,MuseScore,MuseScore is music notation software used by millions of musicians worldwide,https://musescore.org/en,"['c++', 'qt', 'qml', 'cmake']"
115,mypy,Mypy is an optional static type checker for Python.,http://mypy-lang.org/,['python']
116,MZmine,MZmine is an open-source software for mass-spectrometry data processing.,http://www.mzmine.org,"['java', 'javafx']"
117,National Resource for Network Biology (NRNB),Developing open source software to enable network-based biomedical discovery,https://nrnb.org/gsoc.html,"['java', 'javascript', 'python', 'r', 'rest']"
118,Neovim,hyperextensible Vim-based text editor,http://www.neovim.io,"['c', 'lua', 'rpc']"
119,Netty,Netty is an asynchronous event-driven network framework,https://netty.io,"['java', 'jni', 'c']"
120,NumFOCUS,NumFOCUS promotes open source scientific software.,http://numfocus.org/,"['python', 'c/c++', 'javascript', 'r', 'julia']"
121,NV Access,Empowering lives through non-visual access to technology,https://www.nvaccess.org/,"['python', 'c++', 'ui automation', 'iaccessible2', 'win32 api']"
122,Open Bioinformatics Foundation (OBF),Promoting practice & philosophy of OSS & Open Science in biological research.,https://www.open-bio.org,"['python', 'javascript', 'c/c++']"
123,Open Chemistry,Advancing Open Source and Open Science for Chemistry,https://openchemistry.org/,"['c/c++', 'python', 'javascript', 'opengl', 'html']"
124,Open Genome Informatics,Association of open access genomics and bioinformatics projects.,http://gmod.org/wiki/GSoC,"['neo4j', 'python', 'javascript', 'react', 'r-project']"
125,Open Roberta,Open Roberta® Lab is an online IDE introducing kids to program robots with NEPO®,https://lab.open-roberta.org/,"['java', 'javascript']"
126,Open Source Robotics Foundation,"Open source software for use in robotics research, education and industry",https://www.openrobotics.org/,"['ros', 'gazebo', 'c++', 'python']"
127,OpenAstronomy,Opening the eyes of research astronomy software to the whole world.,http://www.OpenAstronomy.org,"['python', 'julia', 'spark', 'numba', 'javascript']"
128,OpenCV,https://opencv.org,https://opencv.org/,"['c/c++', 'python 3', 'javascript', 'cuda']"
129,OpenEMR,OpenEMR is a leader in healthcare open-source software,https://www.open-emr.org/,"['php', 'mysql', 'javascript', 'docker', 'html']"
130,OpenHMD,Multi-Platform Open Source driver for AR/VR/XR devices with stable ABI.,http://openhmd.net,"['c99', 'opengl', 'vulkan', 'opencv', 'libusb']"
131,OpenMined,Answer questions using data you cannot see.,http://www.openmined.org,"['deep learning', 'federated learning', 'homomorphic encryption', 'secure multi-party computation', 'differential privacy']"
132,OpenMRS,Write code. Save lives.,https://openmrs.org/,"['java', 'javascript', 'spring', 'mysql', 'android']"
133,OpenRefine,"a free, open source power tool for working with messy data and improving it",http://openrefine.org/,"['java', 'javascript']"
134,OpenStreetMap,Creating and distributing free geographic data for the world.,http://www.openstreetmap.org/,"['javascript', 'java', 'python', 'sql', 'docker']"
135,openSUSE Project,openSUSE is a worldwide Free and Open Source Software community and project.,https://www.opensuse.org/,"['linux', 'python', 'perl', 'rpm', 'javascript']"
136,OpenWISP,A Hackable Network Management System for the 21st Century,http://openwisp.org,"['python', 'django', 'openwrt', 'javascript', 'lua']"
137,Oppia Foundation,Oppia is used for collaboratively building interactive and intelligent tutors.,https://github.com/oppia/oppia,"['angular', 'python', 'css', 'kotlin', 'webpack']"
138,Orcasound,Humans & machines listening together to save the whales.,http://orcasound.net,"['elixir', 'react', 'javascript', 'python', 'raspberry pi']"
139,OSGeo,The Open Source Geospatial Foundation,https://www.osgeo.org/,"['c/c++', 'python', 'sql', 'open source databases', 'java']"
140,OWASP Foundation,"OWASP, The Open Web Application Security Project",https://owasp.org/,"['python', 'javascript', '.net', 'node.js']"
141,PEcAn Project,"Ecosystem science, policy, and management informed by the best data and models",http://pecanproject.org,"['r', 'python', 'docker', 'postgresql', 'kubernetes']"
142,Percona,Unbiased open source database experts.,https://www.percona.com/,"['javascript', 'shell script', 'golang', 'prometheus', 'grafana']"
143,Performance Co-Pilot,System-level performance analysis toolkit,https://pcp.io/,"['c', 'redis', 'grafana', 'rest', 'libuv']"
144,Pitivi,Allowing everyone on the planet to express themselves through filmmaking,http://pitivi.org/,"['gtk', 'gstreamer', 'c', 'python 3']"
145,Point Cloud Library,An open project for 2D/3D image and point cloud processing.,https://pointcloudlibrary.github.io/,"['cpp', 'cmake', 'devops']"
146,PostgreSQL,PostgreSQL is the world's most advanced Open Source database!,https://www.postgresql.org,"['postgresql', 'postgres', 'sql', 'c', 'perl']"
147,Postman,The Collaboration Platform for API Development,https://www.postman.com/open-philosophy/,"['node.js', 'javascript']"
148,Processing Foundation,Our goal is to empower people of all backgrounds to learn how to program.,http://processingfoundation.org,"['python', 'android', 'opengl', 'java', 'javascript']"
149,Purr Data,realtime audio/video visual programming language,https://www.purrdata.net/,"['html5', 'javascript', 'opengl', 'svg', 'c/c++']"
150,Python Software Foundation,Python is a programming language used by software developers and scientists.,https://www.python.org/,['python']
151,QEMU,Open source machine emulator and virtualizer,https://qemu.org/,"['linux', 'kvm', 'c', 'virtualization', 'rust']"
152,Qubes OS,A reasonably security operating system,https://www.qubes-os.org/,"['c', 'python', 'xen', 'shell', 'linux']"
153,R Project for Statistical Computing,R is a free software environment for statistical computing and graphics,https://www.r-project.org/,"['r-project', 'c', 'c++', 'fortran', 'javascript']"
154,Radare,Radare2 - Reverse Engineering Framework and Toolset,https://radare.org/,"['c', 'c++', 'python', 'go', 'qt']"
155,ReactOS,Open your windows to freedom!,https://reactos.org,"['c', 'c++', 'win32', 'nt']"
156,Red Hen Lab,Research on Multimodal Communication,http://redhenlab.org,"['nlp', 'asr', 'opencv', 'machine learning', 'data science']"
157,RoboComp,An open-source framework to develop and manage robot components,https://robocomp.org,"['python', 'c++11', 'component-based development', 'qt', 'opencv']"
158,Rocket.Chat,Open source team chat and federated collaboration platform,https://rocket.chat,"['javascript', 'react', 'reactnative', 'chatbots', 'ruby']"
159,RTEMS Project,RTEMS is a real-time operating system kernel used around the world and in space.,https://www.rtems.org/,"['c/c++', 'python', 'assembly', 'posix', 'bsd unix']"
160,Ruby,"The Ruby programming language, libraries, and Ruby projects",https://ruby-lang.org,"['ruby', 'c', 'java']"
161,SageMath,open-source mathematics software system,https://www.sagemath.org/,"['python', 'cython']"
162,Samba,Opening windows to a wider world,https://samba.org/,"['smb', 'cifs', 'c', 'python']"
163,SCoRe Lab,"SCoRe has conducted research covering various aspects of Security, Mobile & IOT.",https://www.scorelab.org/,"['python', 'mobile', 'cloud', 'web development', 'machine learning']"
164,ScummVM,ScummVM is a GSoC umbrella for game preservation projects,https://www.scummvm.org/,"['c++', 'sdl', 'opengl', 'assembly', 'lua']"
165,Shogun,Unified and efficient Machine Learning,https://www.shogun.ml/,"['python', 'c++', 'data science', 'machine learning', 'matlab']"
166,SPDX,An open standard for communicating Software Bill of Materials,https://spdx.org/,"['python', 'java', 'golang', 'node.js', 'xml']"
167,Ste||ar group,Shaping a Scalable Future,http://stellar-group.org/,"['cpp', 'hpx', 'python', 'hpc', 'cuda']"
168,strace,linux syscall tracer,https://strace.io,"['linux', 'c', 'shell', 'make', 'awk']"
169,Submitty,Programming assignment submission with automated grading and manual TA grading,https://submitty.org/,"['php', 'python', 'postgresql', 'c++', 'javascript']"
170,Sugar Labs,"We make tools that learners use to explore, discover, create, and reflect.",http://sugarlabs.org,"['python', 'javascript', 'gtk', 'pygame', 'c']"
171,Swift,"Swift is a modern, type-safe, and fun general purpose programming language",https://swift.org,"['swift', 'c++']"
172,SymbiFlow,A completely FOSS toolchain for FPGAs.,https://symbiflow.github.io,"['c/c++', 'fpga', 'python', 'verilog']"
173,SymPy,Symbolic mathematics in Python,https://www.sympy.org/,['python']
174,Synfig,Open-source 2D animation software,https://synfig.org,"['c++', 'gtk', 'gtkmm', 'python']"
175,syslog-ng,"syslog-ng is an enhanced log daemon, supporting a wide range of I/O methods",https://www.syslog-ng.com/,"['elasticsearch', 'kafka', 'sql', 'python', 'c']"
176,TARDIS-SN,Exploring supernovae made easy,https://tardis-sn.github.io/tardis/,['python']
177,TensorFlow,An open-source machine learning framework for everyone.,https://www.tensorflow.org,"['machine learning', 'deep learning', 'python', 'data analysis', 'c/c++']"
178,The Apache Software Foundation,Providing open source software to the public free of charge,https://www.apache.org,"['java', 'c++']"
179,The GNU Project,GNU is a free software Operating System and a collection of other utilities,http://gnu.org,"['c/c++', 'javascript', 'android', 'python', 'scheme']"
