Serial No,Name,Description,Link,Tags
180,The Honeynet Project,The Honeynet Project - R&D for Honeypot/Honeynet Technology and InfoSec Research,https://honeynet.org/,"['python', 'golang', 'honeypot', 'machine learning', 'networking']"
181,The Java Pathfinder Team,JPF is a highly extensible Java virtual machine built for software verification,https://github.com/javapathfinder/jpf-core/,"['javajava', 'jvm', 'android', 'distributed systems']"
182,The Julia Language,A fresh approach to Technical Computing,https://julialang.org,"['julia', 'julialang']"
183,The Libreswan Project,Encrypting the Internet with IKE and IPsec,https://libreswan.org,"['c', 'python']"
184,The Linux Foundation,A non-profit consortium dedicated to fostering the growth of Linux,http://www.linuxfoundation.org/,"['c', 'c++', 'cups', 'ipp']"
185,The LLVM Compiler Infrastructure,LLVM Compiler Infrastructure,http://llvm.org,"['llvm', 'clang', 'mlir']"
186,The Mifos Initiative,End Poverty One Line of Code at a Time,https://mifos.org,"['android', 'java', 'angular', 'mysql', 'spring']"
187,The NetBSD Foundation,Of course it runs NetBSD,https://www.NetBSD.org/,"['c', 'bsd make']"
188,The ns-3 Network Simulator Project,ns-3 is a packet-level network simulator for research and education.,https://www.nsnam.org,"['c/c++', 'python']"
189,The Terasology Foundation,Voxel world game/engine with a large focus on extensibility and developer tools,https://terasology.org/,"['java', 'lwgjl', 'opengl', 'blender', 'gradle']"
190,The Wine Project,"Wine runs Windows applications on Linux, BSD, Solaris, macOS and Android.",https://www.winehq.org/,"['c', 'opengl', 'directx', 'win32', 'vulkan']"
191,VideoLAN,Open Source Multimedia for everyone,https://www.videolan.org/,"['c++', 'asm', 'c', 'go', 'c#']"
192,webpack,webpack is a module bundler.,https://webpack.js.org/,"['javascript', 'webpack']"
193,Wikimedia Foundation,Global movement whose mission is to bring free educational content to the world,http://wikimediafoundation.org/,"['html', 'css', 'python', 'javascript', 'php']"
194,Wireshark,Wireshark is the world's foremost network protocol analyzer.,https://www.wireshark.org/,"['qt', 'c/c++', 'lua', 'pcap', 'cmake']"
195,X.Org Foundation,"X Window System and related projects (Mesa, DRI, Wayland, etc.)",http://www.x.org,"['x11', 'opencl', 'opengl', 'wayland', 'vulkan']"
196,Xapian Search Engine Library,"Fast, scalable and flexible search",https://xapian.org/,"['c++', 'unicode', 'swig', 'linux', 'golang']"
197,XMPP Standards Foundation,Secure and federated communication with open standards,https://xmpp.org,"['java', 'xmpp', 'vala', 'webrtc', 'lua']"
198,XWiki,The Advanced Open Source Enterprise Wiki,https://www.xwiki.org/,"['java', 'javascript', 'html5', 'css', 'velocity']"
199,Zulip,"Powerful, modern, open source team chat, complete with apps for every platform.",https://zulipchat.com,"['python', 'react native', 'django', 'typescript', 'electron']"
